{
  "schemaVersion": 1,
  "id": "current-pie-noop-control",
  "baseCommit": "42be003b8261825966536cde337bd393fa524004",
  "type": "settings-overlay",
  "hypothesisDimension": "matched-no-op-control",
  "changedPaths": [],
  "apply": {},
  "contentHash": "13fe7ebb8decce25fac007893af400f72c94bba212138836c1c184f533808344",
  "validation": [
    "npm run experiment:test",
    "npm run experiment:calibrate"
  ]
}
