{
  "schemaVersion": 1,
  "id": "javascript-general-best-practices-v1",
  "baseCommit": "217573a054cdb0ba0f094294430bad1af35ba12b",
  "type": "skill-override",
  "hypothesisDimension": "native-general-and-javascript-best-practice-skills",
  "changedPaths": [
    "benchmarks/recipes/javascript-general-best-practices-v1/skills/engineering-best-practices/SKILL.md",
    "benchmarks/recipes/javascript-general-best-practices-v1/skills/javascript-best-practices/SKILL.md"
  ],
  "apply": {
    "skills": [
      {
        "name": "engineering-best-practices",
        "description": "General software-engineering guidance for making safe, focused changes in an existing codebase. Use for implementation, debugging, refactoring, or optimization tasks.",
        "path": "skills/engineering-best-practices"
      },
      {
        "name": "javascript-best-practices",
        "description": "JavaScript and Node.js guidance for correctness, maintainability, and performance. Use when modifying .js, .mjs, or .cjs source files.",
        "path": "skills/javascript-best-practices"
      }
    ]
  },
  "contentHash": "ca51f7f06e48f72b591f5c340b2f5fbf6897140424e05499598302776e802ab4",
  "validation": [
    "npm run experiment:test",
    "npm run experiment:calibrate -- bespoke-optimization-v1"
  ]
}
