{
  "schemaVersion": 1,
  "id": "current-pie-noop-control-r2",
  "baseCommit": "f5fb9dfc1d337751ca8dac2550c89bdf41e082a2",
  "type": "settings-overlay",
  "hypothesisDimension": "matched-no-op-control",
  "changedPaths": [],
  "apply": {},
  "contentHash": "13fe7ebb8decce25fac007893af400f72c94bba212138836c1c184f533808344",
  "validation": [
    "npm run experiment:test",
    "npm run experiment:calibrate"
  ]
}
