{
  "schemaVersion": 1,
  "id": "optimization-planning-v2",
  "baseCommit": "6f8d7f6a4deb4802c255d1ba42a16ec2c70b4029",
  "type": "prompt-override",
  "hypothesisDimension": "robust-measure-plan-iterate",
  "changedPaths": [
    "benchmarks/recipes/optimization-planning-v2/prompt.md"
  ],
  "apply": {
    "appendSystemPromptFile": "prompt.md"
  },
  "contentHash": "a1697c53b69844d8a2508a5fa739f8b5c9032f735c9325e03cd9698a73d66cd0",
  "validation": [
    "npm run experiment:test",
    "npm run experiment:calibrate"
  ]
}
